{
  "objective": {
    "id": "adipocytes_biomass",
    "reaction": "Adipocytes_biomass_maintenance",
    "category": "organ_biomass",
    "is_baseline": false,
    "rationale": "Adipose tissue is the body's primary lipid-storage compartment, metabolically distinct from lean organs."
  },
  "provenance": {
    "model": "S85",
    "scale": "microbiome",
    "kind": "mat",
    "source": "/home/farid/projects/cuGEM/microbiome_models/mWBM_S85_male.mat",
    "sha256": "271d1590e4b75ecabb6ee8b7eda3f04a270497afc86689ed842afe364bb9c6eb",
    "n_cols": 874634,
    "n_eq_rows": 734457,
    "n_total_rows": 1993029,
    "nnz": 6137523,
    "obj_nonzero": 1,
    "maximize": true,
    "objective_id": "adipocytes_biomass",
    "objective_rxn": "Adipocytes_biomass_maintenance",
    "objective_idx": 77385
  },
  "build_s": 72.05260475864634,
  "reps": 1,
  "time_limit": 900.0,
  "res_tol": 0.0001,
  "obj_tol": 1e-06,
  "versions": {
    "gpu_name": "NVIDIA RTX A4500",
    "gurobi_version": "13.0.2",
    "cuopt_version": "26.06.00",
    "python": "3.13.13"
  },
  "timestamp": "2026-07-27T17:04:10.045370+00:00",
  "gurobi": {
    "repeats": [
      {
        "repeat": 0,
        "solve_s": 82.76091344282031,
        "objective": 21.428571428571427,
        "status": "Optimal",
        "iters": 91,
        "residual_inf": 1.4072487388716581e-05,
        "feasible": true
      }
    ],
    "solve_s_median": 82.76091344282031,
    "solve_s_min": 82.76091344282031,
    "solve_s_max": 82.76091344282031,
    "objective": 21.428571428571427,
    "feasible": true
  },
  "cuopt": {
    "repeats": [
      {
        "repeat": 0,
        "solve_s": 522.0757,
        "objective": 21.428571428571427,
        "status": "Optimal",
        "iters": 984000,
        "residual_inf": 8.868415896295202e-05,
        "feasible": true
      }
    ],
    "solve_s_median": 522.0757,
    "solve_s_min": 522.0757,
    "solve_s_max": 522.0757,
    "objective": 21.428571428571427,
    "feasible": true
  },
  "obj_rel_diff": 0.0,
  "both_feasible": true
}