{
  "objective": {
    "id": "nkcells_biomass",
    "reaction": "Nkcells_biomass_maintenance",
    "category": "immune_cell_biomass",
    "is_baseline": false,
    "rationale": "NK cells represent innate lymphoid immunity, distinct lineage from the adaptive T/B-cell objectives."
  },
  "provenance": {
    "model": "S85",
    "scale": "microbiome",
    "kind": "mat",
    "source": "/home/farid/projects/cuGEM/microbiome_models/mWBM_S85_male.mat",
    "sha256": "271d1590e4b75ecabb6ee8b7eda3f04a270497afc86689ed842afe364bb9c6eb",
    "n_cols": 874634,
    "n_eq_rows": 734457,
    "n_total_rows": 1993029,
    "nnz": 6137523,
    "obj_nonzero": 1,
    "maximize": true,
    "objective_id": "nkcells_biomass",
    "objective_rxn": "Nkcells_biomass_maintenance",
    "objective_idx": 53180
  },
  "build_s": 70.00825610011816,
  "reps": 1,
  "time_limit": 900.0,
  "res_tol": 0.0001,
  "obj_tol": 1e-06,
  "versions": {
    "gpu_name": "NVIDIA RTX A4500",
    "gurobi_version": "13.0.2",
    "cuopt_version": "26.06.00",
    "python": "3.13.13"
  },
  "timestamp": "2026-07-27T17:36:41.612145+00:00",
  "gurobi": {
    "repeats": [
      {
        "repeat": 0,
        "solve_s": 52.15913824364543,
        "objective": 0.0035357142857142857,
        "status": "Optimal",
        "iters": 91,
        "residual_inf": 9.8540391428e-07,
        "feasible": true
      }
    ],
    "solve_s_median": 52.15913824364543,
    "solve_s_min": 52.15913824364543,
    "solve_s_max": 52.15913824364543,
    "objective": 0.0035357142857142857,
    "feasible": true
  },
  "cuopt": {
    "repeats": [
      {
        "repeat": 0,
        "solve_s": 518.5783,
        "objective": 0.0035357142857142857,
        "status": "Optimal",
        "iters": 984000,
        "residual_inf": 8.868415896295202e-05,
        "feasible": true
      }
    ],
    "solve_s_median": 518.5783,
    "solve_s_min": 518.5783,
    "solve_s_max": 518.5783,
    "objective": 0.0035357142857142857,
    "feasible": true
  },
  "obj_rel_diff": 0.0,
  "both_feasible": true
}