{
  "objective": {
    "id": "kidney_biomass",
    "reaction": "Kidney_biomass_maintenance",
    "category": "organ_biomass",
    "is_baseline": false,
    "rationale": "Kidney is the second-largest organ compartment and central to whole-body nitrogen/electrolyte handling."
  },
  "provenance": {
    "model": "S85",
    "scale": "microbiome",
    "kind": "mat",
    "source": "/home/farid/projects/cuGEM/microbiome_models/mWBM_S85_male.mat",
    "sha256": "271d1590e4b75ecabb6ee8b7eda3f04a270497afc86689ed842afe364bb9c6eb",
    "n_cols": 874634,
    "n_eq_rows": 734457,
    "n_total_rows": 1993029,
    "nnz": 6137523,
    "obj_nonzero": 1,
    "maximize": true,
    "objective_id": "kidney_biomass",
    "objective_rxn": "Kidney_biomass_maintenance",
    "objective_idx": 17275
  },
  "build_s": 69.05620591389015,
  "reps": 1,
  "time_limit": 900.0,
  "res_tol": 0.0001,
  "obj_tol": 1e-06,
  "versions": {
    "gpu_name": "NVIDIA RTX A4500",
    "gurobi_version": "13.0.2",
    "cuopt_version": "26.06.00",
    "python": "3.13.13"
  },
  "timestamp": "2026-07-27T15:36:18.762713+00:00",
  "gurobi": {
    "repeats": [
      {
        "repeat": 0,
        "solve_s": 54.740632788743824,
        "objective": 0.44285714285714284,
        "status": "Optimal",
        "iters": 91,
        "residual_inf": 9.8540391428e-07,
        "feasible": true
      }
    ],
    "solve_s_median": 54.740632788743824,
    "solve_s_min": 54.740632788743824,
    "solve_s_max": 54.740632788743824,
    "objective": 0.44285714285714284,
    "feasible": true
  },
  "cuopt": {
    "repeats": [
      {
        "repeat": 0,
        "solve_s": 511.381,
        "objective": 0.44285714285714284,
        "status": "Optimal",
        "iters": 984000,
        "residual_inf": 8.868415896295202e-05,
        "feasible": true
      }
    ],
    "solve_s_median": 511.381,
    "solve_s_min": 511.381,
    "solve_s_max": 511.381,
    "objective": 0.44285714285714284,
    "feasible": true
  },
  "obj_rel_diff": 0.0,
  "both_feasible": true
}