{
  "objective": {
    "id": "muscle_biomass",
    "reaction": "Muscle_biomass_maintenance",
    "category": "organ_biomass",
    "is_baseline": false,
    "rationale": "Skeletal muscle is the largest body-mass compartment overall, dominant in whole-body amino-acid/glucose turnover."
  },
  "provenance": {
    "model": "S85",
    "scale": "microbiome",
    "kind": "mat",
    "source": "/home/farid/projects/cuGEM/microbiome_models/mWBM_S85_male.mat",
    "sha256": "271d1590e4b75ecabb6ee8b7eda3f04a270497afc86689ed842afe364bb9c6eb",
    "n_cols": 874634,
    "n_eq_rows": 734457,
    "n_total_rows": 1993029,
    "nnz": 6137523,
    "obj_nonzero": 1,
    "maximize": true,
    "objective_id": "muscle_biomass",
    "objective_rxn": "Muscle_biomass_maintenance",
    "objective_idx": 77375
  },
  "build_s": 69.4130951310508,
  "reps": 1,
  "time_limit": 900.0,
  "res_tol": 0.0001,
  "obj_tol": 1e-06,
  "versions": {
    "gpu_name": "NVIDIA RTX A4500",
    "gurobi_version": "13.0.2",
    "cuopt_version": "26.06.00",
    "python": "3.13.13"
  },
  "timestamp": "2026-07-27T16:09:27.837426+00:00",
  "gurobi": {
    "repeats": [
      {
        "repeat": 0,
        "solve_s": 87.62362292502075,
        "objective": 40.0,
        "status": "Optimal",
        "iters": 91,
        "residual_inf": 1.4072487388716581e-05,
        "feasible": true
      }
    ],
    "solve_s_median": 87.62362292502075,
    "solve_s_min": 87.62362292502075,
    "solve_s_max": 87.62362292502075,
    "objective": 40.0,
    "feasible": true
  },
  "cuopt": {
    "repeats": [
      {
        "repeat": 0,
        "solve_s": 536.5644,
        "objective": 40.0,
        "status": "Optimal",
        "iters": 984000,
        "residual_inf": 8.868415896295202e-05,
        "feasible": true
      }
    ],
    "solve_s_median": 536.5644,
    "solve_s_min": 536.5644,
    "solve_s_max": 536.5644,
    "objective": 40.0,
    "feasible": true
  },
  "obj_rel_diff": 0.0,
  "both_feasible": true
}