{
  "objective": {
    "id": "microbe_akkermansia_muciniphila",
    "reaction": "panAkkermansia_muciniphila_biomassPan",
    "category": "microbiome",
    "is_baseline": false,
    "rationale": "Mucin-degrading commensal associated with host metabolic health; representative Verrucomicrobia-phylum taxon."
  },
  "provenance": {
    "model": "S85",
    "scale": "microbiome",
    "kind": "mat",
    "source": "/home/farid/projects/cuGEM/microbiome_models/mWBM_S85_male.mat",
    "sha256": "271d1590e4b75ecabb6ee8b7eda3f04a270497afc86689ed842afe364bb9c6eb",
    "n_cols": 874634,
    "n_eq_rows": 734457,
    "n_total_rows": 1993029,
    "nnz": 6137523,
    "obj_nonzero": 1,
    "maximize": true,
    "objective_id": "microbe_akkermansia_muciniphila",
    "objective_rxn": "panAkkermansia_muciniphila_biomassPan",
    "objective_idx": 127061
  },
  "build_s": 69.07324645388871,
  "reps": 1,
  "time_limit": 900.0,
  "res_tol": 0.0001,
  "obj_tol": 1e-06,
  "versions": {
    "gpu_name": "NVIDIA RTX A4500",
    "gurobi_version": "13.0.2",
    "cuopt_version": "26.06.00",
    "python": "3.13.13"
  },
  "timestamp": "2026-07-27T18:40:10.678618+00:00",
  "gurobi": {
    "repeats": [
      {
        "repeat": 0,
        "solve_s": 53.46480264980346,
        "objective": 0.000101434,
        "status": "Optimal",
        "iters": 91,
        "residual_inf": 9.8540391428e-07,
        "feasible": true
      }
    ],
    "solve_s_median": 53.46480264980346,
    "solve_s_min": 53.46480264980346,
    "solve_s_max": 53.46480264980346,
    "objective": 0.000101434,
    "feasible": true
  },
  "cuopt": {
    "repeats": [
      {
        "repeat": 0,
        "solve_s": 508.5629,
        "objective": 0.000101434,
        "status": "Optimal",
        "iters": 984000,
        "residual_inf": 8.868415896295202e-05,
        "feasible": true
      }
    ],
    "solve_s_median": 508.5629,
    "solve_s_min": 508.5629,
    "solve_s_max": 508.5629,
    "objective": 0.000101434,
    "feasible": true
  },
  "obj_rel_diff": 0.0,
  "both_feasible": true
}